{
  "name": "My NFT List",
  "timestamp": "2023-08-15T12:34:56Z",
  "nfts": [
    {
      "chainId": 1,
      "address": "0x7d8820fa92eb1584636f4f5b8515b5476b75171a",
      "nftType": "ERC721",
      "symbol": "M.F",
      "name": "Murakami.Flowers Official"
    }
  ],
  "version": {
    "major": 1,
    "minor": 0,
    "patch": 0
  }
}